{
  "$schema": "https://json-schema.org/draft/2020-12/schema",
  "$id": "https://github.com/omarespejel/uc/benchmarks/corpora/deployed-contract-corpus.schema.json",
  "title": "uc deployed contract benchmark corpus",
  "type": "object",
  "additionalProperties": false,
  "required": ["schema_version", "corpus_id", "chain", "selection", "deduplication", "items"],
  "allOf": [
    {
      "if": {
        "properties": {
          "selection": {
            "properties": {
              "coverage": { "const": "complete_deployed_contracts" }
            },
            "required": ["coverage"]
          }
        },
        "required": ["selection"]
      },
      "then": {
        "properties": {
          "items": {
            "items": {
              "required": ["source_kind", "contract_address"],
              "properties": {
                "source_kind": { "const": "deployed_contract" }
              }
            }
          }
        }
      }
    }
  ],
  "properties": {
    "schema_version": { "const": 1 },
    "corpus_id": { "type": "string", "minLength": 1 },
    "chain": { "type": "string", "minLength": 1 },
    "selection": {
      "type": "object",
      "additionalProperties": false,
      "required": ["source", "snapshot_id", "from_block", "to_block", "coverage"],
      "properties": {
        "source": { "type": "string", "minLength": 1 },
        "snapshot_id": { "type": "string", "minLength": 1 },
        "from_block": { "type": "integer", "minimum": 0 },
        "to_block": { "type": "integer", "minimum": 0 },
        "coverage": { "enum": ["sample", "complete_deployed_contracts"] },
        "notes": { "type": "string" }
      }
    },
    "deduplication": {
      "type": "object",
      "additionalProperties": false,
      "required": ["key", "input_count", "deduped_count"],
      "properties": {
        "key": { "enum": ["class_hash", "source_package", "none"] },
        "input_count": { "type": "integer", "minimum": 1 },
        "deduped_count": { "type": "integer", "minimum": 1 },
        "rules": { "type": "string" }
      }
    },
    "license_policy": { "type": "string" },
    "items": {
      "type": "array",
      "minItems": 1,
      "items": {
        "type": "object",
        "additionalProperties": false,
        "required": ["tag", "class_hash", "source_ref", "manifest_path", "cairo_version"],
        "allOf": [
          {
            "if": {
              "properties": { "source_kind": { "const": "deployed_contract" } },
              "required": ["source_kind"]
            },
            "then": { "required": ["contract_address"] }
          },
          {
            "if": { "not": { "required": ["source_kind"] } },
            "then": { "required": ["contract_address"] }
          }
        ],
        "properties": {
          "tag": { "type": "string", "pattern": "^[A-Za-z0-9._-]+$" },
          "source_kind": {
            "enum": ["deployed_contract", "declared_class"],
            "description": "Whether this row represents a deployed contract address or declared class source evidence."
          },
          "contract_address": { "type": "string", "minLength": 1 },
          "class_hash": { "type": "string", "minLength": 1 },
          "source_ref": { "type": "string", "minLength": 1 },
          "manifest_path": { "type": "string", "minLength": 1 },
          "cairo_version": { "type": "string", "minLength": 1 },
          "scarb_version": { "type": "string" },
          "license": { "type": "string" },
          "notes": { "type": "string" }
        }
      }
    }
  }
}
